<?xml version="1.0" ?>
<!DOCTYPE bulletml SYSTEM "bulletml.dtd">
<bulletml>
  <action label="top">
    <fire>
      <bullet>
        <speed>1</speed>
        <sprite>1</sprite>
        <action>
          <wait>100</wait>
          <fire>
              <direction type="absolute">$rand * 360</direction>
              <speed>1</speed>
              <sprite>3</sprite>
            <bullet />
          </fire>
        </action>
      </bullet>
    </fire>
  </action>
</bulletml>