<?xml version="1.0"?>
<!DOCTYPE bulletml SYSTEM "bulletml.dtd">
<bulletml>
  <action label="top">
      <fire>
        <direction type="absolute">10</direction>
        <speed>1</speed>
        <bullet />
      </fire>
      <fire>
        <direction type="sequence">0</direction>
        <speed>1</speed>
        <bullet />
      </fire>
  </action>
</bulletml>